<?xml version="1.0" encoding="UTF-8"?>
<course
  xmlns="https://csmp.missouriwestern.edu"
  xmlns:xsi="http://www.w3.org/2001/XMLSchema-instance"
  xsi:schemaLocation="https://csmp.missouriwestern.edu/xml/curriculum/course.xsd">
  <college>LA</college>
  <subject>SEC</subject>
  <number>620</number>
  <title>Cloud Computing Security</title>
  <offered>spring-even</offered>
  <scheduleType>lecture</scheduleType>
  <catalogDescription>
Enterprise-scale cloud computing is proliferating because of its cost effectiveness and enhanced resource manageability. The primary objective of this course is to equip students with solid understanding of cloud computing. It covers cloud computing and services in both business and technical viewpoints. Cloud security architecture will also be covered with an emphasis on the four major categories of security controls.
  </catalogDescription>
  <prerequisites>
    <prerequisiteDisjunction>
      <prerequisiteCourse minimumGrade="C"><subject>SEC</subject><number>300</number></prerequisiteCourse>
      <prerequisiteCourse minimumGrade="C" corequisite="true"><subject>SEC</subject><number>600</number></prerequisiteCourse>
    </prerequisiteDisjunction>
  </prerequisites>
  <objectives>
    <objective>Describe cloud characteristics, and its fundamental and technical concepts</objective>
    <objective>Identify cloud management platforms that manage virtual machines, and virtualized infrastructures and workloads</objective>
    <objective>Compare various cloud management strategies</objective>
    <objective>Apply common security concepts and tools to identify potential risks and security threats</objective>
    <objective>Differentiate well-known security measures and decide their applicability in given scenarios</objective>
  </objectives>
  <outline>
<!--
    <topic>Enterprise-scale cloud computing
	<topic>business value of cloud computing</topic>
	<topic>different types of cloud computing</topic>
	<topic>transitioning from traditional IT infrastructures to cloud computing</topic>
	<topic>identifying and handling security threats</topic>
	<topic>securing sensitive data in cloud environment</topic>
	<topic>cloud service management</topic>
    </topic>
    <topic>Cloud security architecture
	<topic>Deterrent controls</topic>
	<topic>Preventive controls</topic>
	<topic>Detective controls</topic>
	<topic>Corrective controls</topic>
    </topic>
-->
	<topic>The Basics of Cloud Computing Security
		<topic>Cloud Security Baselines</topic>
		<topic>Cloud Security, Privacy, and Trust Baselines</topic>
	</topic>
	<topic>Risk Analysis and Division of Responsibility
		<topic>Risk and Trust Assessment: Schemes for Cloud Services</topic>
		<topic>Managing Risk in the Cloud</topic>
		<topic>Cloud Security Risk Management</topic>
		<topic>Secure Cloud Risk Management: Risk Mitigation Methods</topic>
	</topic>
	<topic>Securing the Cloud Infrastructure
		<topic>Specification and Enforcement of Access Policies in Emerging Scenarios</topic>
		<topic>Cloud Security Access Control: Distributed Access Control</topic>
		<topic>Cloud Security Key Management: Cloud User Controls</topic>
		<topic>Cloud Computing Security Essentials and Architecture</topic>
		<topic>Cloud Computing Architecture and Security Concepts</topic>
		<topic>Secure Cloud Architecture</topic>
	</topic>
	<topic>Meeting Compliance Requirements
		<topic>Negotiating Cloud Security Requirements with Vendors</topic>
		<topic>Managing Legal Compliance Risk in the Cloud and Negotiating Personal Data Protection Requirements with Vendors</topic>
		<topic>Computing Technology for Trusted Cloud Security</topic>
		<topic>Trusted Computing Technology and Proposals for Resolving Cloud Computing Security Problems</topic>
	</topic>
	<topic>Preparing for Disaster Recovery
		<topic>Simplifying Secure Cloud Computing Environments with Cloud Data Centers</topic>
		<topic>Availability, Recovery, and Auditing across Data Centers</topic>
	</topic>
	<topic>Advanced Cloud Computing Security
		<topic>Advanced Security Architectures for Cloud Computing</topic>
		<topic>Side-Channel Attacks and Defenses on Cloud Traffic</topic>
		<topic>Clouds are Evil</topic>
		<topic>Future Directions in Cloud Computing Security: Risks and Challenges</topic>
	</topic>
  </outline>
</course>
