<?xml version="1.0" encoding="UTF-8"?>
<course
  xmlns="https://csmp.missouriwestern.edu"
  xmlns:xsi="http://www.w3.org/2001/XMLSchema-instance"
  xsi:schemaLocation="https://csmp.missouriwestern.edu/xml/curriculum/course.xsd">
  <college>LA</college>
  <subject>CSC</subject>
  <number>650</number>
  <title>Information Assurance</title>
  <offered>spring</offered>
  <scheduleType>lecture</scheduleType>
  <catalogDescription>
This course will explore cyber-security principles by examining security policies and procedures for managing critical and sensitive data. Implications for government compliance, professional ethics, and organizational risk management will be addressed in relation to the task of preserving the confidentiality, authenticity, integrity, and availability of such data.
  </catalogDescription>
  <prerequisites>
  </prerequisites>
  <objectives>
    <objective>Understand the importance of, and how to provide, confidentiality, authenticity,
integrity, and availability of data.
      <covers standard="acm-csec2017" knowledgeArea="5" id="2"/>
    </objective>
    <objective>Develop IT security policies and analyze their adherence to legal, ethical, and other
constraints.
      <covers standard="acm-csec2017" knowledgeArea="5" id="3"/>
      <covers standard="acm-csec2017" knowledgeArea="5" id="4"/>
      <covers standard="acm-csec2017" knowledgeArea="5" id="5"/>
    </objective>
    <objective>Gain skill in researching best practices and efficacy of security controls.
      <covers standard="acm-csec2017" knowledgeArea="5" id="11"/>
    </objective>
    <objective>Apply risk management concepts in a security and information assurance context.
      <covers standard="acm-csec2017" knowledgeArea="7/1" id="3"/>
    </objective>
    <objective>Conduct and support investigations in to security breaches and assess their
consequences.
      <covers standard="acm-csec2017" knowledgeArea="1/2" id="1"/>
    </objective>
    <objective>Develop strategies to plan for and recover from security related catastrophic events.
      <covers standard="acm-csec2017" knowledgeArea="5" id="17"/>
    </objective>
    <objective>Gain skill in educating a non-technical audience over IT policy.
      <covers standard="acm-csec2017" knowledgeArea="6/4" id="2"/>
    </objective>
    <objective>Prepare for advanced and expert-level professional IT certification</objective>
  </objectives>
  <outline>
    <topic>CASP / CISSP topic review</topic>
    <topic>Classifying and Documenting Data and Assets</topic>
    <topic>Determining Security Requirements and Controls</topic>
    <topic>IT Audits</topic>
    <topic>Data Protection and Access Controls</topic>
    <topic>Aligning Information Assurance Goals with Organizational Goals</topic>
    <topic>Developing Policies</topic>
    <topic>Implementing and Documenting Policies</topic>
    <topic>Communicating and Enforcing Policies</topic>
    <topic>Regulatory Constraints on Policies</topic>
    <topic>Professional Ethics</topic>
    <topic>Risk Analysis</topic>
    <topic>Contingency Planning</topic>
    <topic>Investigations and Forensics</topic>
    <topic>Incident Reporting</topic>
    <topic>Disaster Recovery</topic>
    <topic>Professional Communication</topic>
    <topic>Technical Training</topic>
  </outline>
</course>
