<?xml version="1.0" encoding="UTF-8"?>
<course
  xmlns="https://csmp.missouriwestern.edu"
  xmlns:xsi="http://www.w3.org/2001/XMLSchema-instance"
  xsi:schemaLocation="https://csmp.missouriwestern.edu/xml/curriculum/course.xsd">
  <college>LA</college>
  <subject>CSC</subject>
  <number>245</number>
  <title>Enterprise Systems Computing: COBOL I</title>
  <offered>fall-even</offered>
  <scheduleType>lecture</scheduleType>
  <catalogDescription>
This course explores the structure of the COBOL programming language, to include basic syntax, flow control, record and memory structures, input/output and report writing. A real-world enterprise system environment will be used to provide exposure to JCL and various tools that support business processes and information flow. 
  </catalogDescription>
  <prerequisites>
    <prerequisiteCourse minimumGrade="C"><subject>CSC</subject><number>254</number></prerequisiteCourse>
  </prerequisites>
  <objectives>
    <objective>stub</objective>
  </objectives>
  <outline>
    <topic>stub</topic>
  </outline>
</course>
