<?xml version="1.0" encoding="UTF-8"?>
<course
  xmlns="https://csmp.missouriwestern.edu"
  xmlns:xsi="http://www.w3.org/2001/XMLSchema-instance"
  xsi:schemaLocation="https://csmp.missouriwestern.edu/xml/curriculum/course.xsd">
  <college>LA</college>
  <subject>CSC</subject>
  <number>328</number>
  <title>Computer Graphics</title>
  <offered>spring</offered>
  <scheduleType>lecture</scheduleType>
  <catalogDescription>
	  stub
  </catalogDescription>
  <prerequisites>
    <prerequisiteCourse minimumGrade="C"><subject>CSC</subject><number>285</number></prerequisiteCourse>
  </prerequisites>
  <objectives>
    <objective>stub</objective>
  </objectives>
  <outline>
    <topic>stub</topic>
  </outline>
</course>
