<?xml version="1.0" encoding="UTF-8"?>
<course
  xmlns="https://csmp.missouriwestern.edu"
  xmlns:xsi="http://www.w3.org/2001/XMLSchema-instance"
  xsi:schemaLocation="https://csmp.missouriwestern.edu/xml/curriculum/course.xsd">
  <college>LA</college>
  <subject>MAT</subject>
  <number>165</number>
  <title>Calculus with Analytic Geometry I: Differentiation</title>
  <offered>fall</offered>
  <scheduleType>lecture</scheduleType>
  <catalogDescription>Includes the study of limits and continuity of real functions, the derivative of algebraic and trigonometric functions, and applications of the derivative. Not open to the student with credit in MAT 167.</catalogDescription>
  <prerequisites>
    <prerequisiteDisjunction>
      <prerequisiteGeneral>an ACT math subscore of at least 25</prerequisiteGeneral>
      <prerequisiteConjunction>
        <prerequisiteCourse minimumGrade="C">
          <subject>MAT</subject>
          <number>116</number>
        </prerequisiteCourse>
        <prerequisiteCourse corequisite="true" minimumGrade="C">
          <subject>MAT</subject>
          <number>119</number>
        </prerequisiteCourse>
      </prerequisiteConjunction>
    </prerequisiteDisjunction>
  </prerequisites>
  <objectives>
    <objective>Compute limits of algebraic and trigonometric functions.</objective>
    <objective>Utilize the definition of derivative to derive or prove mathematical statements.</objective>
    <objective>Find derivatives of algebraic and trigonometric functions.</objective>
    <objective>Identify and use interpretations of the derivative to solve problems related to curve sketching, related rates, and optimization.</objective>
    <objective>Utilize mathematical language and symbolism to communicate ideas and represent relationships.</objective>
    <objective>Interact verbally with others to clarify and extend understanding of mathematical situations.</objective>
  </objectives>
  <outline>
    <topic>stub
      <topic>stub</topic>
    </topic>
  </outline>
</course>
