<?xml version="1.0" encoding="UTF-8"?>
<course
  xmlns="https://csmp.missouriwestern.edu"
  xmlns:xsi="http://www.w3.org/2001/XMLSchema-instance"
  xsi:schemaLocation="https://csmp.missouriwestern.edu/xml/curriculum/course.xsd">
  <college>LA</college>
  <subject>ACT</subject>
  <number>302</number>
  <title>Decision Support Systems</title>
  <offered>spring</offered>
  <scheduleType>lecture</scheduleType>
  <catalogDescription>
This course uses statistics to help solve business problems, examines case examples of statistical analysis in areas such as marketing, finance and management, and teaches descriptive and inferential techniques using a statistical computer software application - Excel. Topics to be covered include Creating Charts, Working with Charts, Using List Features and Templates, Working with Advanced Functions, Analyzing Data, Using PivotTables, and Working with Data Analysis Tools.
  </catalogDescription>
  <prerequisites>
    <prerequisiteCourse minimumGrade="C"><subject>CSC</subject><number>201</number></prerequisiteCourse>
  </prerequisites>
  <objectives>
    <objective>stub</objective>
  </objectives>
  <outline>
    <topic>stub</topic>
  </outline>
</course>
